Name,Description,Technique,Rule Type,Severity,Source
Account Password Reset Remotely,Identifies an attempt to reset a potentially privileged account password remotely. Adversaries may manipulate account passwords to maintain access or evade...,"T1098, T1531",EQL,Medium,[GitHub ↗](https://github.com/elastic/detection-rules/blob/main/rules/windows/persistence_remote_password_reset.toml)
Attempt to Deactivate an Okta Application,"Detects attempts to deactivate an Okta application. An adversary may attempt to modify, deactivate, or delete an Okta application in order to weaken an...",T1489,Custom Query,Low,[GitHub ↗](https://github.com/elastic/detection-rules/blob/main/rules/integrations/okta/impact_okta_attempt_to_deactivate_okta_application.toml)
Attempt to Delete an Okta Application,"Detects attempts to delete an Okta application. An adversary may attempt to modify, deactivate, or delete an Okta application in order to weaken an...",T1489,Custom Query,Low,[GitHub ↗](https://github.com/elastic/detection-rules/blob/main/rules/integrations/okta/impact_okta_attempt_to_delete_okta_application.toml)
Attempt to Modify an Okta Application,"Detects attempts to modify an Okta application. An adversary may attempt to modify, deactivate, or delete an Okta application in order to weaken an...",,Custom Query,Low,[GitHub ↗](https://github.com/elastic/detection-rules/blob/main/rules/integrations/okta/impact_okta_attempt_to_modify_okta_application.toml)
Attempt to Revoke Okta API Token,Identifies attempts to revoke an Okta API token. An adversary may attempt to revoke or delete an Okta API token to disrupt an organization's business...,T1531,Custom Query,Low,[GitHub ↗](https://github.com/elastic/detection-rules/blob/main/rules/integrations/okta/impact_attempt_to_revoke_okta_api_token.toml)
AWS CloudTrail Log Updated,"Detects updates to an existing CloudTrail trail via UpdateTrail API which may reduce visibility, change destinations, or weaken integrity (e.g., removing...","T1530, T1565, T1565.001",Custom Query,Low,[GitHub ↗](https://github.com/elastic/detection-rules/blob/main/rules/integrations/aws/impact_cloudtrail_logging_updated.toml)
AWS CloudWatch Log Group Deletion,"Detects the deletion of an Amazon CloudWatch Log Group using the ""DeleteLogGroup"" API. CloudWatch log groups store operational and security logs for AWS...","T1485, T1562, T1562.001",Custom Query,Medium,[GitHub ↗](https://github.com/elastic/detection-rules/blob/main/rules/integrations/aws/impact_cloudwatch_log_group_deletion.toml)
AWS CloudWatch Log Stream Deletion,"Detects the deletion of an Amazon CloudWatch log stream using the ""DeleteLogStream"" API. Deleting a log stream permanently removes its associated log events...","T1485, T1562, T1562.001",Custom Query,Medium,[GitHub ↗](https://github.com/elastic/detection-rules/blob/main/rules/integrations/aws/impact_cloudwatch_log_stream_deletion.toml)
AWS EC2 EBS Snapshot Access Removed,Identifies the removal of access permissions from a shared AWS EC2 EBS snapshot. EBS snapshots are essential for data retention and disaster recovery....,"T1485, T1490",EQL,Medium,[GitHub ↗](https://github.com/elastic/detection-rules/blob/main/rules/integrations/aws/impact_ec2_ebs_snapshot_access_removed.toml)
AWS EFS File System Deleted,"Identifies the deletion of an Amazon EFS file system using the ""DeleteFileSystem"" API operation. Deleting an EFS file system permanently removes all stored...",T1485,Custom Query,Medium,[GitHub ↗](https://github.com/elastic/detection-rules/blob/main/rules/integrations/aws/impact_efs_filesystem_deleted.toml)
AWS EventBridge Rule Disabled or Deleted,Identifies when an Amazon EventBridge rule is disabled or deleted. EventBridge rules are commonly used to automate operational workflows and...,T1489,Custom Query,Low,[GitHub ↗](https://github.com/elastic/detection-rules/blob/main/rules/integrations/aws/impact_aws_eventbridge_rule_disabled_or_deleted.toml)
AWS IAM Deactivation of MFA Device,Detects the deactivation of a Multi-Factor Authentication (MFA) device in AWS Identity and Access Management (IAM). MFA provides critical protection against...,"T1531, T1556, T1556.006",Custom Query,Medium,[GitHub ↗](https://github.com/elastic/detection-rules/blob/main/rules/integrations/aws/impact_iam_deactivate_mfa_device.toml)
AWS IAM Group Deletion,"Detects when an IAM group is deleted using the DeleteGroup API call. Deletion of an IAM group may represent a malicious attempt to remove audit trails,...",T1531,Custom Query,Low,[GitHub ↗](https://github.com/elastic/detection-rules/blob/main/rules/integrations/aws/impact_iam_group_deletion.toml)
AWS KMS Customer Managed Key Disabled or Scheduled for Deletion,Identifies attempts to disable or schedule the deletion of an AWS customer managed KMS Key. Disabling or scheduling a KMS key for deletion removes the...,T1485,Custom Query,Medium,[GitHub ↗](https://github.com/elastic/detection-rules/blob/main/rules/integrations/aws/impact_kms_cmk_disabled_or_scheduled_for_deletion.toml)
AWS RDS DB Instance or Cluster Deleted,"Identifies the deletion of an Amazon RDS DB instance, Aurora cluster, or global database cluster. Deleting these resources permanently destroys stored data...",T1485,Custom Query,Medium,[GitHub ↗](https://github.com/elastic/detection-rules/blob/main/rules/integrations/aws/impact_rds_instance_cluster_deletion.toml)
AWS RDS DB Instance or Cluster Deletion Protection Disabled,Identifies the modification of an AWS RDS DB instance or cluster to disable the deletionProtection feature. Deletion protection prevents accidental or...,T1485,EQL,Medium,[GitHub ↗](https://github.com/elastic/detection-rules/blob/main/rules/integrations/aws/impact_rds_instance_cluster_deletion_protection_disabled.toml)
AWS RDS Snapshot Deleted,Identifies the deletion of an AWS RDS DB snapshot or configuration changes that effectively remove backup coverage for a DB instance. RDS snapshots contain...,T1485,EQL,Medium,[GitHub ↗](https://github.com/elastic/detection-rules/blob/main/rules/integrations/aws/impact_rds_snapshot_deleted.toml)
AWS S3 Bucket Enumeration or Brute Force,Identifies a high number of failed S3 operations against a single bucket from a single source address within a short timeframe. This activity can indicate...,"T1530, T1619, T1657",Threshold,Low,[GitHub ↗](https://github.com/elastic/detection-rules/blob/main/rules/integrations/aws/impact_aws_s3_bucket_enumeration_or_brute_force.toml)
AWS S3 Bucket Expiration Lifecycle Configuration Added,Identifies the addition of an expiration lifecycle configuration to an Amazon S3 bucket. S3 lifecycle rules can automatically delete or transition objects...,"T1070, T1485, T1485.001, T1562, T1562.008",EQL,Low,[GitHub ↗](https://github.com/elastic/detection-rules/blob/main/rules/integrations/aws/defense_evasion_s3_bucket_lifecycle_expiration_added.toml)
AWS S3 Object Encryption Using External KMS Key,Identifies use of the S3 CopyObject API where the destination object is encrypted using an AWS KMS key from an external AWS account. This behavior may...,T1486,ES|QL,Medium,[GitHub ↗](https://github.com/elastic/detection-rules/blob/main/rules/integrations/aws/impact_s3_object_encryption_with_external_key.toml)
AWS S3 Object Versioning Suspended,Identifies when object versioning is suspended for an Amazon S3 bucket. Object versioning allows for multiple versions of an object to exist in the same...,T1490,EQL,Medium,[GitHub ↗](https://github.com/elastic/detection-rules/blob/main/rules/integrations/aws/impact_s3_object_versioning_disabled.toml)
AWS S3 Static Site JavaScript File Uploaded,This rule detects when a JavaScript file is uploaded in an S3 static site directory (`static/js/`) by an IAM user or assumed role. This can indicate...,"T1565, T1565.001",ES|QL,Medium,[GitHub ↗](https://github.com/elastic/detection-rules/blob/main/rules/integrations/aws/impact_s3_static_site_js_file_uploaded.toml)
AWS S3 Unauthenticated Bucket Access by Rare Source,Identifies AWS CloudTrail events where an unauthenticated source is attempting to access an S3 bucket. This activity may indicate a misconfigured S3 bucket...,"T1485, T1530, T1619",New Terms,Medium,[GitHub ↗](https://github.com/elastic/detection-rules/blob/main/rules/integrations/aws/collection_s3_unauthenticated_bucket_access_by_rare_source.toml)
AWS SNS Rare Protocol Subscription by User,"Identifies when a use subscribes to an SNS topic using a new protocol type (ie. email, http, lambda, etc.). SNS allows users to subscribe to recieve topic...","T1496, T1496.004, T1530, T1567",New Terms,Low,[GitHub ↗](https://github.com/elastic/detection-rules/blob/main/rules/integrations/aws/exfiltration_sns_rare_protocol_subscription_by_user.toml)
AWS SNS Topic Created by Rare User,Identifies when an SNS topic is created by a user who does not typically perform this action. Adversaries may create SNS topics to stage capabilities for...,"T1496, T1496.004, T1608",New Terms,Low,[GitHub ↗](https://github.com/elastic/detection-rules/blob/main/rules/integrations/aws/resource_development_sns_topic_created_by_rare_user.toml)
AWS SNS Topic Message Publish by Rare User,"Identifies when an SNS topic message is published by a rare user in AWS. Adversaries may publish messages to SNS topics for phishing campaigns, data...","T1496, T1496.004, T1534, T1567",New Terms,Medium,[GitHub ↗](https://github.com/elastic/detection-rules/blob/main/rules/integrations/aws/lateral_movement_sns_topic_message_publish_by_rare_user.toml)
Azure Compute Restore Point Collection Deleted by Unusual User,Identifies the deletion of Azure Restore Point Collections by a user who has not previously performed this activity. Restore Point Collections contain...,T1490,New Terms,Medium,[GitHub ↗](https://github.com/elastic/detection-rules/blob/main/rules/integrations/azure/impact_azure_compute_restore_point_collection_deleted.toml)
Azure Compute Restore Point Collections Deleted,Identifies multiple Azure Restore Point Collections being deleted by a single user within a short time period. Restore Point Collections contain recovery...,T1490,Threshold,High,[GitHub ↗](https://github.com/elastic/detection-rules/blob/main/rules/integrations/azure/impact_azure_compute_restore_point_collections_deleted.toml)
Azure Compute Snapshot Deletion by Unusual User and Resource Group,"Identifies when an Azure disk snapshot is deleted by an unusual user in a specific resource group. Snapshots are critical for backup, disaster recovery, and...","T1485, T1490",New Terms,Low,[GitHub ↗](https://github.com/elastic/detection-rules/blob/main/rules/integrations/azure/impact_azure_compute_vm_snapshot_deletion.toml)
Azure Compute Snapshot Deletions by User,Identifies when a single user or service principal deletes multiple Azure disk snapshots within a short time period. This behavior may indicate an adversary...,"T1485, T1490",Threshold,Medium,[GitHub ↗](https://github.com/elastic/detection-rules/blob/main/rules/integrations/azure/impact_azure_compute_vm_snapshot_deletions.toml)
Azure Kubernetes Services (AKS) Kubernetes Pods Deleted,Identifies the deletion of Azure Kubernetes Pods. Adversaries may delete a Kubernetes pod to disrupt the normal behavior of the environment.,"T1489, T1529",Custom Query,Medium,[GitHub ↗](https://github.com/elastic/detection-rules/blob/main/rules/integrations/azure/impact_kubernetes_pod_deleted.toml)
Azure Recovery Services Resource Deleted,"Identifies the deletion of Azure Recovery Services resources. Azure Recovery Services vaults contain data for copies of VMs, workloads, servers, and other...",T1490,Custom Query,Medium,[GitHub ↗](https://github.com/elastic/detection-rules/blob/main/rules_building_block/impact_azure_recovery_services_deletion.toml)
Azure Storage Account Deletion by Unusual User,"Identifies when an Azure Storage Account is deleted. Adversaries may delete storage accounts to disrupt operations, destroy evidence, or cause denial of...","T1485, T1489",New Terms,Medium,[GitHub ↗](https://github.com/elastic/detection-rules/blob/main/rules/integrations/azure/impact_azure_storage_account_deletion.toml)
Azure Storage Account Deletions by User,Identifies when a single user or service principal deletes multiple Azure Storage Accounts within a short time period. This behavior may indicate an...,"T1485, T1489",Threshold,High,[GitHub ↗](https://github.com/elastic/detection-rules/blob/main/rules/integrations/azure/impact_azure_storage_account_deletion_multiple.toml)
Backup Deletion with Wbadmin,"Detects use of wbadmin.exe to delete backup catalogs, system state backups, or other backup data. Ransomware and other malware may do this to prevent system...","T1485, T1490",EQL,Low,[GitHub ↗](https://github.com/elastic/detection-rules/blob/main/rules/windows/impact_deleting_backup_catalogs_with_wbadmin.toml)
Decline in host-based traffic,"A machine learning job has detected a sudden drop in host based traffic. This can be due to a range of security issues, such as a compromised system, a...","T1499, T1562",Machine Learning,Low,[GitHub ↗](https://github.com/elastic/detection-rules/blob/main/rules/ml/ml_low_count_events_for_a_host_name.toml)
Deprecated - M365 Security Compliance Potential Ransomware Activity,Identifies when Microsoft Cloud App Security flags potential ransomware activity in Microsoft 365. This rule detects events where the Security Compliance...,T1486,Custom Query,Medium,[GitHub ↗](https://github.com/elastic/detection-rules/blob/main/rules/integrations/o365/impact_security_compliance_potential_ransomware_activity.toml)
Deprecated - M365 Security Compliance Unusual Volume of File Deletion,Identifies that a user has deleted an unusually large volume of files as reported by Microsoft Cloud App Security.,T1485,Custom Query,Medium,[GitHub ↗](https://github.com/elastic/detection-rules/blob/main/rules/integrations/o365/impact_security_compliance_unusual_volume_of_file_deletion.toml)
Deprecated - M365 Security Compliance User Restricted from Sending Email,Identifies when a user has been restricted from sending email due to exceeding sending limits of the service policies per the Security Compliance Center.,,Custom Query,Medium,[GitHub ↗](https://github.com/elastic/detection-rules/blob/main/rules/integrations/o365/initial_access_security_compliance_user_restricted_from_sending_email.toml)
Detection Alert on a Process Exhibiting CPU Spike,This rule correlates security alerts with processes exhibiting unusually high CPU utilization on the same host and process ID within a short time window....,,ES|QL,High,[GitHub ↗](https://github.com/elastic/detection-rules/blob/main/rules/cross-platform/impact_alert_from_a_process_with_cpu_spike.toml)
Excessive AWS S3 Object Encryption with SSE-C,Identifies a high-volume of AWS S3 objects stored in a bucket using using Server-Side Encryption with Customer-Provided Keys (SSE-C). Adversaries with...,T1486,Threshold,High,[GitHub ↗](https://github.com/elastic/detection-rules/blob/main/rules/integrations/aws/impact_s3_excessive_object_encryption_with_sse_c.toml)
GCP Service Account Deletion,Identifies when a service account is deleted in Google Cloud Platform (GCP). A service account is a special type of account used by an application or a...,T1531,Custom Query,Medium,[GitHub ↗](https://github.com/elastic/detection-rules/blob/main/rules/integrations/gcp/impact_gcp_service_account_deleted.toml)
GCP Service Account Disabled,Identifies when a service account is disabled in Google Cloud Platform (GCP). A service account is a special type of account used by an application or a...,T1531,Custom Query,Medium,[GitHub ↗](https://github.com/elastic/detection-rules/blob/main/rules/integrations/gcp/impact_gcp_service_account_disabled.toml)
Github Activity on a Private Repository from an Unusual IP,Detects when there is activity on a private GitHub repository from an unusual IP address. Adversaries may access private repositories from unfamiliar IPs to...,"T1059, T1195, T1195.002",New Terms,Low,[GitHub ↗](https://github.com/elastic/detection-rules/blob/main/rules/integrations/github/impact_github_repository_activity_from_unusual_ip.toml)
GitHub PAT Access Revoked,Access to private GitHub organization resources was revoked for a PAT.,T1531,EQL,Low,[GitHub ↗](https://github.com/elastic/detection-rules/blob/main/rules_building_block/impact_github_pat_access_revoked.toml)
GitHub Private Repository Turned Public,Detects when a private GitHub repository is changed to public visibility. Adversaries may change repository visibility to public in order to exfiltrate...,"T1020, T1567, T1567.001",EQL,Low,[GitHub ↗](https://github.com/elastic/detection-rules/blob/main/rules/integrations/github/exfiltration_github_private_repository_turned_public.toml)
GitHub Repository Deleted,This rule detects when a GitHub repository is deleted within your organization. Repositories are a critical component used within an organization to manage...,T1485,EQL,Medium,[GitHub ↗](https://github.com/elastic/detection-rules/blob/main/rules/integrations/github/impact_github_repository_deleted.toml)
GitHub User Blocked From Organization,A GitHub user was blocked from access to an organization.,T1531,EQL,Low,[GitHub ↗](https://github.com/elastic/detection-rules/blob/main/rules_building_block/impact_github_user_blocked_from_organization.toml)
Google Workspace Admin Role Deletion,Detects when a custom admin role is deleted. An adversary may delete a custom admin role in order to impact the permissions or capabilities of system...,T1531,Custom Query,Medium,[GitHub ↗](https://github.com/elastic/detection-rules/blob/main/rules/integrations/google_workspace/impact_google_workspace_admin_role_deletion.toml)
Google Workspace MFA Enforcement Disabled,Detects when multi-factor authentication (MFA) enforcement is disabled for Google Workspace users. An adversary may disable MFA enforcement in order to...,T1531,Custom Query,Medium,[GitHub ↗](https://github.com/elastic/detection-rules/blob/main/rules/integrations/google_workspace/impact_google_workspace_mfa_enforcement_disabled.toml)
High Number of Closed Pull Requests by User,Detects a high number of closed pull requests by a single user within a short time frame. Adversaries may close multiple pull requests to disrupt...,"T1020, T1485, T1567, T1567.001",ES|QL,Medium,[GitHub ↗](https://github.com/elastic/detection-rules/blob/main/rules/integrations/github/impact_high_number_of_closed_pull_requests_by_user.toml)
High Number of Process and/or Service Terminations,"This rule identifies a high number (10) of process terminations (stop, delete, or suspend) from the same host within a short time period.",T1489,Threshold,Medium,[GitHub ↗](https://github.com/elastic/detection-rules/blob/main/rules/windows/impact_stop_process_service_threshold.toml)
High Number of Process Terminations,This rule identifies a high number (10) of process terminations via pkill from the same host within a short time period.,T1489,Threshold,Medium,[GitHub ↗](https://github.com/elastic/detection-rules/blob/main/rules/linux/impact_process_kill_threshold.toml)
High Number of Protected Branch Force Pushes by User,Detects a high number of force push actions to protected branches by a single user within a short time frame. Adversaries may perform force pushes to...,"T1020, T1485, T1567, T1567.001",ES|QL,Medium,[GitHub ↗](https://github.com/elastic/detection-rules/blob/main/rules/integrations/github/impact_high_number_of_protected_branch_force_pushes_by_user.toml)
Hosts File Modified,The hosts file on endpoints is used to control manual IP address to hostname resolutions. The hosts file is the first point of lookup for DNS hostname...,"T1565, T1565.001",EQL,Medium,[GitHub ↗](https://github.com/elastic/detection-rules/blob/main/rules/cross-platform/impact_hosts_file_modified.toml)
M365 Purview Insider Risk Signal,"Identifies Microsoft Purview Insider Risk Management signals including alerts, cases, scoped user insights, HR signals, and physical badging signals. These...",,Custom Query,Low,[GitHub ↗](https://github.com/elastic/detection-rules/blob/main/rules_building_block/collection_microsoft_purview_insider_risk_signal.toml)
M365 Purview Security Compliance Signal,Collects alerts generated by Microsoft Purview (formerly Office 365 Security & Compliance Center) through the SecurityComplianceCenter provider. These...,,Custom Query,Low,[GitHub ↗](https://github.com/elastic/detection-rules/blob/main/rules_building_block/initial_access_microsoft_purview_security_compliance_signal.toml)
Member Removed From GitHub Organization,A member was removed or their invitation to join was removed from a GitHub Organization.,T1531,EQL,Low,[GitHub ↗](https://github.com/elastic/detection-rules/blob/main/rules_building_block/impact_github_member_removed_from_organization.toml)
Memory Swap Modification,This rule detects memory swap modification events on Linux systems. Memory swap modification can be used to manipulate the system's memory and potentially...,"T1059, T1059.004, T1496",EQL,Medium,[GitHub ↗](https://github.com/elastic/detection-rules/blob/main/rules/linux/impact_memory_swap_modification.toml)
Modification of Boot Configuration,Identifies use of bcdedit.exe to delete boot configuration data. This tactic is sometimes used as by malware or an attacker as a destructive technique.,T1490,EQL,Low,[GitHub ↗](https://github.com/elastic/detection-rules/blob/main/rules/windows/impact_modification_of_boot_config.toml)
Multiple Alerts on a Host Exhibiting CPU Spike,This rule correlates multiple security alerts from a host exhibiting unusually high CPU utilization within a short time window. This behavior may indicate...,,ES|QL,Critical,[GitHub ↗](https://github.com/elastic/detection-rules/blob/main/rules/cross-platform/impact_alerts_on_host_with_cpu_spike.toml)
Newly Observed Process Exhibiting High CPU Usage,This rule alerts on processes exhibiting high CPU usage and that are observed for the first time in the previous 5 days. A previously unseen process...,"T1496, T1496.001",ES|QL,High,[GitHub ↗](https://github.com/elastic/detection-rules/blob/main/rules/cross-platform/impact_newly_observed_process_with_high_cpu.toml)
Possible Okta DoS Attack,Detects possible Denial of Service (DoS) attacks against an Okta organization. An adversary may attempt to disrupt an organization's business operations by...,"T1498, T1499",Custom Query,Medium,[GitHub ↗](https://github.com/elastic/detection-rules/blob/main/rules/integrations/okta/impact_possible_okta_dos_attack.toml)
Potential AWS S3 Bucket Ransomware Note Uploaded,Identifies potential ransomware note being uploaded to an AWS S3 bucket. This rule detects the PutObject S3 API call with an object name commonly associated...,"T1485, T1486",EQL,Medium,[GitHub ↗](https://github.com/elastic/detection-rules/blob/main/rules/integrations/aws/impact_s3_bucket_object_uploaded_with_ransom_keyword.toml)
Potential Linux Ransomware Note Creation Detected,This rule identifies a sequence of a mass file encryption event in conjunction with the creation of a .txt file with a file name containing ransomware...,T1486,EQL,Medium,[GitHub ↗](https://github.com/elastic/detection-rules/blob/main/rules/linux/impact_potential_linux_ransomware_note_detected.toml)
Potential Malware-Driven SSH Brute Force Attempt,This detection identifies a Linux host that has potentially been infected with malware and is being used to conduct brute-force attacks against external...,"T1059, T1059.004, T1071, T1496",ES|QL,Medium,[GitHub ↗](https://github.com/elastic/detection-rules/blob/main/rules/linux/impact_potential_bruteforce_malware_infection.toml)
Potential Ransomware Behavior - Note Files by System,This rule identifies the creation of multiple files with same name and over SMB by the same user. This behavior may indicate the successful remote execution...,"T1021, T1021.002, T1485",ES|QL,Medium,[GitHub ↗](https://github.com/elastic/detection-rules/blob/main/rules/windows/impact_high_freq_file_renames_by_kernel.toml)
Potential Ransomware Note File Dropped via SMB,Identifies an incoming SMB connection followed by the creation of a file with a name similar to ransomware note files. This may indicate a remote ransomware...,"T1021, T1021.002, T1485, T1490",EQL,High,[GitHub ↗](https://github.com/elastic/detection-rules/blob/main/rules/windows/impact_ransomware_note_file_over_smb.toml)
Potential Secure File Deletion via SDelete Utility,Detects file name patterns generated by the use of Sysinternals SDelete utility to securely delete a file via multiple file overwrite and rename operations.,"T1070, T1070.004, T1485",EQL,Low,[GitHub ↗](https://github.com/elastic/detection-rules/blob/main/rules/windows/defense_evasion_sdelete_like_filename_rename.toml)
Potential System Tampering via File Modification,Identifies attempts to delete or modify critical files used during the boot process to prevent the system from booting. This may indicate a destructive...,"T1485, T1490",EQL,High,[GitHub ↗](https://github.com/elastic/detection-rules/blob/main/rules/windows/impact_mod_critical_os_files.toml)
Ransomware - Detected - Elastic Defend,Generates a detection alert each time an Elastic Defend alert for ransomware are received. Enabling this rule allows you to immediately begin investigating...,T1486,Custom Query,High,[GitHub ↗](https://github.com/elastic/detection-rules/blob/main/rules/integrations/endpoint/impact_elastic_ransomware_detected.toml)
