Name,Description,Technique,Rule Type,Severity,Source
Ransomware - Prevented - Elastic Defend,Generates a detection alert each time an Elastic Defend alert for ransomware are received. Enabling this rule allows you to immediately begin investigating...,T1486,Custom Query,High,[GitHub ↗](https://github.com/elastic/detection-rules/blob/main/rules/integrations/endpoint/impact_elastic_ransomware_prevented.toml)
Service Disabled via Registry Modification,Identifies attempts to modify services start settings using processes other than services.exe. Attackers may attempt to modify security and monitoring...,"T1112, T1489",EQL,Low,[GitHub ↗](https://github.com/elastic/detection-rules/blob/main/rules_building_block/defense_evasion_service_disabled_registry.toml)
Several Failed Protected Branch Force Pushes by User,Detects a high number of failed force push attempts to protected branches by a single user within a short time frame. Adversaries may attempt multiple force...,"T1020, T1485, T1567, T1567.001",ES|QL,Medium,[GitHub ↗](https://github.com/elastic/detection-rules/blob/main/rules/integrations/github/impact_high_number_of_failed_protected_branch_force_pushes_by_user.toml)
Spike in Firewall Denies,A machine learning job detected an unusually large spike in network traffic that was denied by network access control lists (ACLs) or firewall rules. Such a...,"T1041, T1046, T1071, T1498, T1499, T1590",Machine Learning,Low,[GitHub ↗](https://github.com/elastic/detection-rules/blob/main/rules/ml/ml_high_count_network_denies.toml)
Spike in host-based traffic,"A machine learning job has detected a sudden spike in host based traffic. This can be due to a range of security issues, such as a compromised system, DDoS...","T1041, T1068, T1204, T1498, T1499",Machine Learning,Low,[GitHub ↗](https://github.com/elastic/detection-rules/blob/main/rules/ml/ml_high_count_events_for_a_host_name.toml)
Spike in Network Traffic,"A machine learning job detected an unusually large spike in network traffic. Such a burst of traffic, if not caused by a surge in business activity, can be...","T1041, T1046, T1498, T1595",Machine Learning,Low,[GitHub ↗](https://github.com/elastic/detection-rules/blob/main/rules/ml/ml_high_count_network_events.toml)
SSL Certificate Deletion,This rule detects the deletion of SSL certificates on a Linux system. Adversaries may delete SSL certificates to subvert trust controls and negatively...,"T1070, T1070.004, T1485, T1553",EQL,Low,[GitHub ↗](https://github.com/elastic/detection-rules/blob/main/rules/linux/defense_evasion_ssl_certificate_deletion.toml)
Suspicious Data Encryption via OpenSSL Utility,Identifies when the openssl command-line utility is used to encrypt multiple files on a host within a short time window. Adversaries may encrypt data on a...,T1486,EQL,Medium,[GitHub ↗](https://github.com/elastic/detection-rules/blob/main/rules/linux/impact_data_encrypted_via_openssl.toml)
Suspicious File Renamed via SMB,Identifies an incoming SMB connection followed by a suspicious file rename operation. This may indicate a remote ransomware attack via the SMB protocol.,"T1021, T1021.002, T1485, T1490",EQL,High,[GitHub ↗](https://github.com/elastic/detection-rules/blob/main/rules/windows/impact_ransomware_file_rename_smb.toml)
Suspicious Termination of ESXI Process,"Identifies instances where VMware processes, such as ""vmware-vmx"" or ""vmx,"" are terminated on a Linux system by a ""kill"" command. The rule monitors for the...",T1489,EQL,High,[GitHub ↗](https://github.com/elastic/detection-rules/blob/main/rules/linux/impact_esxi_process_kill.toml)
Third-party Backup Files Deleted via Unexpected Process,"Identifies the deletion of backup files, saved using third-party software, by a process outside of the backup suite. Adversaries may delete Backup files to...","T1485, T1490",EQL,Medium,[GitHub ↗](https://github.com/elastic/detection-rules/blob/main/rules/windows/impact_backup_file_deletion.toml)
Unusual AWS S3 Object Encryption with SSE-C,Identifies when AWS S3 objects stored in a bucket are encrypted using Server-Side Encryption with Customer-Provided Keys (SSE-C). Adversaries with...,T1486,New Terms,High,[GitHub ↗](https://github.com/elastic/detection-rules/blob/main/rules/integrations/aws/impact_s3_unusual_object_encryption_with_sse_c.toml)
Volume Shadow Copy Deleted or Resized via VssAdmin,Identifies use of vssadmin.exe for shadow copy deletion or resizing on endpoints. This commonly occurs in tandem with ransomware or other destructive attacks.,T1490,EQL,High,[GitHub ↗](https://github.com/elastic/detection-rules/blob/main/rules/windows/impact_volume_shadow_copy_deletion_or_resized_via_vssadmin.toml)
Volume Shadow Copy Deletion via PowerShell,Identifies the use of the Win32_ShadowCopy class and related cmdlets to achieve shadow copy deletion. This commonly occurs in tandem with ransomware or...,"T1059, T1059.001, T1490",EQL,High,[GitHub ↗](https://github.com/elastic/detection-rules/blob/main/rules/windows/impact_volume_shadow_copy_deletion_via_powershell.toml)
Volume Shadow Copy Deletion via WMIC,Identifies use of wmic.exe for shadow copy deletion on endpoints. This commonly occurs in tandem with ransomware or other destructive attacks.,"T1047, T1490",EQL,High,[GitHub ↗](https://github.com/elastic/detection-rules/blob/main/rules/windows/impact_volume_shadow_copy_deletion_via_wmic.toml)
